{
  "export_version": "2.2.0",
  "schema_version": "1.3.0",
  "content_hash": "sha256:8d3315d0f50b81722c23cc5d43e0a475b73341ade62922baec121335e26caab7",
  "kernel_version": "3.0.0",
  "relation_registry_version": "1.0.0",
  "relation_registry": {
    "part_of": {
      "family": "structural",
      "inverse": "has_part",
      "transitive": true,
      "domain": [
        "concept",
        "phenomenon",
        "model",
        "quantity"
      ],
      "range": [
        "concept",
        "phenomenon",
        "model",
        "quantity"
      ],
      "status": "adopted"
    },
    "has_part": {
      "family": "structural",
      "inverse": "part_of",
      "transitive": true,
      "domain": [
        "concept",
        "phenomenon",
        "model",
        "quantity"
      ],
      "range": [
        "concept",
        "phenomenon",
        "model",
        "quantity"
      ],
      "status": "reserved"
    },
    "composed_of": {
      "family": "structural",
      "transitive": true,
      "domain": [
        "concept",
        "model",
        "phenomenon"
      ],
      "range": [
        "concept",
        "phenomenon"
      ],
      "status": "reserved"
    },
    "generalizes": {
      "family": "hierarchical",
      "inverse": "special_case_of",
      "transitive": true,
      "domain": [
        "concept",
        "law",
        "model"
      ],
      "range": [
        "concept",
        "law",
        "model"
      ],
      "status": "adopted"
    },
    "special_case_of": {
      "family": "hierarchical",
      "inverse": "generalizes",
      "transitive": true,
      "domain": [
        "concept",
        "law",
        "model"
      ],
      "range": [
        "concept",
        "law",
        "model"
      ],
      "status": "adopted"
    },
    "requires": {
      "family": "dependency",
      "transitive": true,
      "domain": [
        "concept",
        "quantity",
        "law",
        "equation",
        "model",
        "phenomenon"
      ],
      "range": [
        "concept",
        "quantity",
        "law",
        "equation",
        "model",
        "phenomenon"
      ],
      "status": "reserved"
    },
    "prerequisite_of": {
      "family": "dependency",
      "transitive": true,
      "domain": [
        "concept",
        "quantity",
        "law",
        "phenomenon"
      ],
      "range": [
        "concept",
        "quantity",
        "law",
        "phenomenon"
      ],
      "status": "reserved"
    },
    "mathematically_requires": {
      "family": "dependency",
      "inverse": "mathematically_required_by",
      "transitive": true,
      "domain": [
        "law",
        "equation",
        "model",
        "quantity",
        "concept",
        "phenomenon"
      ],
      "range": [
        "concept",
        "quantity",
        "equation",
        "phenomenon",
        "unit",
        "law"
      ],
      "status": "adopted"
    },
    "mathematically_required_by": {
      "family": "dependency",
      "inverse": "mathematically_requires",
      "transitive": true,
      "domain": [
        "concept",
        "quantity",
        "equation",
        "phenomenon",
        "unit",
        "law"
      ],
      "range": [
        "law",
        "equation",
        "model",
        "quantity",
        "concept",
        "phenomenon"
      ],
      "status": "reserved"
    },
    "logically_requires": {
      "family": "dependency",
      "inverse": "logically_required_by",
      "transitive": true,
      "domain": [
        "concept",
        "quantity",
        "law",
        "equation",
        "model",
        "phenomenon",
        "unit"
      ],
      "range": [
        "concept",
        "quantity",
        "law",
        "equation",
        "model",
        "phenomenon",
        "unit"
      ],
      "status": "adopted"
    },
    "logically_required_by": {
      "family": "dependency",
      "inverse": "logically_requires",
      "transitive": true,
      "domain": [
        "concept",
        "quantity",
        "law",
        "equation",
        "model",
        "phenomenon",
        "unit"
      ],
      "range": [
        "concept",
        "quantity",
        "law",
        "equation",
        "model",
        "phenomenon",
        "unit"
      ],
      "status": "reserved"
    },
    "depends_on": {
      "family": "dependency",
      "transitive": true,
      "domain": [
        "concept",
        "quantity",
        "law",
        "equation",
        "model",
        "phenomenon"
      ],
      "range": [
        "concept",
        "quantity",
        "law",
        "equation",
        "model",
        "phenomenon"
      ],
      "status": "reserved"
    },
    "causes": {
      "family": "causal",
      "transitive": false,
      "symmetric": false,
      "domain": [
        "phenomenon",
        "model",
        "law",
        "concept"
      ],
      "range": [
        "phenomenon",
        "concept"
      ],
      "status": "reserved"
    },
    "contributes_to": {
      "family": "causal",
      "transitive": false,
      "symmetric": false,
      "domain": [
        "phenomenon",
        "model",
        "law",
        "concept"
      ],
      "range": [
        "phenomenon",
        "concept"
      ],
      "status": "reserved"
    },
    "results_in": {
      "family": "causal",
      "transitive": false,
      "symmetric": false,
      "domain": [
        "phenomenon",
        "concept",
        "model"
      ],
      "range": [
        "phenomenon",
        "concept"
      ],
      "status": "reserved"
    },
    "influences": {
      "family": "causal",
      "transitive": false,
      "symmetric": false,
      "domain": [
        "phenomenon",
        "concept",
        "model"
      ],
      "range": [
        "phenomenon",
        "concept",
        "model"
      ],
      "status": "reserved"
    },
    "prevents": {
      "family": "causal",
      "transitive": false,
      "symmetric": false,
      "domain": [
        "phenomenon",
        "concept",
        "model"
      ],
      "range": [
        "phenomenon",
        "concept"
      ],
      "status": "reserved"
    },
    "explains": {
      "family": "explanatory",
      "transitive": false,
      "symmetric": false,
      "domain": [
        "law",
        "model"
      ],
      "range": [
        "phenomenon",
        "concept",
        "law"
      ],
      "status": "reserved"
    },
    "accounts_for": {
      "family": "explanatory",
      "transitive": false,
      "symmetric": false,
      "domain": [
        "law",
        "model"
      ],
      "range": [
        "phenomenon",
        "concept"
      ],
      "status": "reserved"
    },
    "predicted_by": {
      "family": "explanatory",
      "transitive": false,
      "symmetric": false,
      "domain": [
        "phenomenon",
        "concept"
      ],
      "range": [
        "law",
        "model"
      ],
      "status": "reserved"
    },
    "supported_by": {
      "family": "explanatory",
      "transitive": false,
      "symmetric": false,
      "domain": [
        "law",
        "model",
        "concept"
      ],
      "range": [
        "phenomenon",
        "concept",
        "law"
      ],
      "status": "reserved"
    },
    "evidenced_by": {
      "family": "explanatory",
      "transitive": false,
      "symmetric": false,
      "domain": [
        "law",
        "model",
        "concept"
      ],
      "range": [
        "phenomenon",
        "concept"
      ],
      "status": "reserved"
    },
    "approximates": {
      "family": "model",
      "inverse": "approximated_by",
      "transitive": false,
      "symmetric": false,
      "domain": [
        "model",
        "equation",
        "law",
        "concept",
        "phenomenon",
        "quantity"
      ],
      "range": [
        "phenomenon",
        "model",
        "law",
        "equation",
        "concept",
        "quantity"
      ],
      "status": "adopted"
    },
    "approximated_by": {
      "family": "model",
      "inverse": "approximates",
      "transitive": false,
      "symmetric": false,
      "domain": [
        "phenomenon",
        "model",
        "law",
        "equation",
        "concept",
        "quantity"
      ],
      "range": [
        "model",
        "equation",
        "law",
        "concept",
        "phenomenon",
        "quantity"
      ],
      "status": "reserved"
    },
    "idealizes": {
      "family": "model",
      "transitive": false,
      "symmetric": false,
      "domain": [
        "model"
      ],
      "range": [
        "phenomenon",
        "model"
      ],
      "status": "reserved"
    },
    "extends": {
      "family": "model",
      "transitive": false,
      "symmetric": false,
      "domain": [
        "model",
        "law"
      ],
      "range": [
        "model",
        "law"
      ],
      "status": "reserved"
    },
    "supersedes": {
      "family": "model",
      "transitive": false,
      "symmetric": false,
      "domain": [
        "model",
        "law"
      ],
      "range": [
        "model",
        "law"
      ],
      "status": "reserved"
    },
    "simplifies": {
      "family": "model",
      "transitive": false,
      "symmetric": false,
      "domain": [
        "model",
        "equation"
      ],
      "range": [
        "model",
        "equation"
      ],
      "status": "reserved"
    },
    "contradicts": {
      "family": "conflict",
      "symmetric": true,
      "transitive": false,
      "domain": [
        "law",
        "model",
        "concept",
        "phenomenon"
      ],
      "range": [
        "law",
        "model",
        "concept",
        "phenomenon"
      ],
      "status": "reserved"
    },
    "inconsistent_with": {
      "family": "conflict",
      "symmetric": true,
      "transitive": false,
      "domain": [
        "law",
        "model",
        "concept",
        "phenomenon"
      ],
      "range": [